{
    "apiVersion": "1",
    "schemaVersion": "1.0.0",
    "locale": "en",
    "type": "product_card",
    "sort": "modified_desc",
    "filter": null,
    "page": 2,
    "perPage": 2,
    "total": 4,
    "totalPages": 2,
    "items": [
        {
            "id": "41000000-0000-4000-8000-000000000004",
            "kind": "catalog_accessory",
            "model": "Flow Control Task-014-accessory_discontinued",
            "name": "TASK-014 Delta Accessory Discontinued",
            "publicPath": null,
            "image": {
                "id": "42000000-0000-4000-8000-000000000004",
                "url": "https://media.gdhe.example/task-014/accessory_discontinued.webp",
                "width": 1200,
                "height": 800,
                "alt": "Protected synthetic TASK-014 product card image"
            },
            "primaryCategory": {
                "id": "44000000-0000-4000-8000-000000000001",
                "label": "TASK-014 Card Products",
                "publicPath": "/products/curtain-track-systems/task-014-card-products/"
            },
            "series": [],
            "applications": [],
            "summary": "Synthetic TASK-007-A3-REVIEW-R1 summary.",
            "keyAttributes": [
                {
                    "key": "system_type",
                    "label": "System type",
                    "value": "Synthetic fixture",
                    "unit": null
                }
            ],
            "lifecycle": "discontinued",
            "action": {
                "mode": "replacement_contact",
                "label": "Contact Us for Replacement",
                "targetPath": "/contact/"
            },
            "modifiedAt": "2026-07-29T08:00:00+00:00"
        },
        {
            "id": "41000000-0000-4000-8000-000000000003",
            "kind": "catalog_accessory",
            "model": "Flow Control Task-014-accessory_active",
            "name": "TASK-014 Gamma Accessory Active",
            "publicPath": null,
            "image": {
                "id": "42000000-0000-4000-8000-000000000003",
                "url": "https://media.gdhe.example/task-014/accessory_active.webp",
                "width": 1200,
                "height": 800,
                "alt": "Protected synthetic TASK-014 product card image"
            },
            "primaryCategory": {
                "id": "44000000-0000-4000-8000-000000000001",
                "label": "TASK-014 Card Products",
                "publicPath": "/products/curtain-track-systems/task-014-card-products/"
            },
            "series": [],
            "applications": [],
            "summary": "Synthetic TASK-007-A3-REVIEW-R1 summary.",
            "keyAttributes": [
                {
                    "key": "system_type",
                    "label": "System type",
                    "value": "Synthetic fixture",
                    "unit": null
                }
            ],
            "lifecycle": "active",
            "action": {
                "mode": "direct_rfq",
                "label": "Request a Quote",
                "targetPath": "/request-a-quote/"
            },
            "modifiedAt": "2026-07-29T08:00:00+00:00"
        }
    ]
}
